id,prigozhin_id,datetime,from,to,text
781,NA,2023-04-18T09:30:53Z,00:33,00:38,"And then, these prisoners are used for different purposes."
781,NA,2023-04-18T09:30:53Z,00:38,00:45,"What we have just seen, it was a task of falsification of the ChVK ""Wagner""."
781,NA,2023-04-18T09:30:53Z,00:45,00:54,"The ChVK ""Wagner"" has done too much for the Western special services, that they decided to expose their agents."
781,NA,2023-04-18T09:30:53Z,00:54,01:13,"But we must clearly understand that these prisoners with these ""sins"", which are secretly kept by Osechkin and his curators, they will be used for explosions in the subway and for other terrorist acts."
781,NA,2023-04-18T09:30:53Z,01:13,01:26,"This is a very dangerous situation, and therefore, of course, we will make every effort and help the law enforcement agencies to fully expose this situation."
781,NA,2023-04-18T09:30:53Z,01:26,01:38,"And everyone who can participate in it, including Osechkin, we must make an effort to find him, arrest and punish in the appropriate way."
781,NA,2023-04-18T09:30:53Z,01:38,01:47,"This is an attempt to destroy us from the inside, and we will look for who is behind this, including inside the state."
779,#1482,2023-04-18T08:49:26Z,00:00,00:09,"Yesterday, the head of the League of Veterans of Local Conflicts, Andrey Troshev, the Hero of Russia,"
779,#1482,2023-04-18T08:49:26Z,00:09,00:17,"wrote a statement to initiate a criminal case on the fact of the scandalous video discrediting ChVK ""Wagner"","
779,#1482,2023-04-18T08:49:26Z,00:17,00:25,"and this is the main thing, the main thing is not me, discrediting ChVK ""Wagner"", which came out on the resource ""Gulag-No""."
779,#1482,2023-04-18T08:49:26Z,00:25,00:33,"This morning, a person called us, ChVK ""Wagner"", one of those who was on this video,"
779,#1482,2023-04-18T08:49:26Z,00:33,00:39,"and said that he is standing on the roof of a ten-story building, wants to commit suicide,"
779,#1482,2023-04-18T08:49:26Z,00:39,00:43,"he was convinced that this ""proko"" will be little,"
779,#1482,2023-04-18T08:49:26Z,00:43,00:49,"will say that it was done with him out of revenge, ChVK ""Wagner"","
779,#1482,2023-04-18T08:49:26Z,00:49,00:59,"and therefore it is better to talk to our journalists, and will help us to unravel the crime that committed ""Gulag-No""."
779,#1482,2023-04-18T08:49:26Z,00:59,01:04,"At the Federal News Agency, you can watch this video,"
779,#1482,2023-04-18T08:49:26Z,01:04,01:09,"then they will keep you informed about the investigation,"
779,#1482,2023-04-18T08:49:26Z,01:09,01:18,"after some time I will make another statement about how it happened, and why what we know now."
779,#1482,2023-04-18T08:49:26Z,01:18,01:27,"Of course, we will withdraw the statement on the initiation of a criminal case against this person,"
779,#1482,2023-04-18T08:49:26Z,01:27,01:39,"since he cooperates actively, and will actively cooperate in order to expose the scoundrels from ""Gulag-No"" and foreign special services."
778,#1481,2023-04-17T20:22:50Z,00:01,00:15,"I can say the following, one of those ""shot"" in quotes, turned out to be shot, and continues to fight."
778,#1481,2023-04-17T20:22:50Z,00:15,00:19,"For the rest, now we understand."
778,#1481,2023-04-17T20:22:50Z,00:21,00:32,"About what ""Kosichkin"" filmed, I watched the pieces of video, what was done,"
778,#1481,2023-04-17T20:22:50Z,00:32,00:39,"I can say the following, if at least one of these accusations in my address is confirmed,"
778,#1481,2023-04-17T20:22:50Z,00:39,00:46,I am ready to bear responsibility according to any laws and rules.
778,#1481,2023-04-17T20:22:50Z,00:46,00:58,"But if it is not confirmed, then I will send a list of 30-40 people who are spitting saliva like ""Kosichkin"","
778,#1481,2023-04-17T20:22:50Z,00:58,01:03,"there is a whole list of them, including ""scoundrels"" who fled from Russia,"
778,#1481,2023-04-17T20:22:50Z,01:03,01:07,"which the Prosecutor General's Office of Ukraine is obliged to pass to me,"
778,#1481,2023-04-17T20:22:50Z,01:07,01:16,"to, so to speak, ""fair"" court over these people, because they will be ""non-peaceful residents"" for us,"
778,#1481,2023-04-17T20:22:50Z,01:16,01:21,"and especially not children, whom we have never touched and do not touch,"
778,#1481,2023-04-17T20:22:50Z,01:21,01:28,"are the most rude lie, but will be enemies, and we will act with them in a special way."
778,#1481,2023-04-17T20:22:50Z,01:28,01:37,"Under these conditions, I am ready to start working with the Prosecutor General's Office of Ukraine immediately."
778,#1481,2023-04-17T20:22:50Z,01:37,01:39,The End
775,NA,2023-04-17T13:20:10Z,00:00,00:05,"Unfortunately, I do not have the technical ability to watch the video in full."
775,NA,2023-04-17T13:20:10Z,00:05,00:11,"As soon as it appears, we will certainly analyze it in detail and give a full assessment."
775,NA,2023-04-17T13:20:10Z,00:11,00:21,"As for the underage soldiers of the Air Force, I think that if Osechkin is talking somewhere in the Ukraine,"
775,NA,2023-04-17T13:20:10Z,00:21,00:30,"let Vladimir Zelensky give it to us, because this maniac and degenerate discredits the Air Force."
775,NA,2023-04-17T13:20:10Z,00:30,00:37,"As for the shootings of children, of course, no one ever shoots a cop or children."
775,NA,2023-04-17T13:20:10Z,00:37,00:39,This is absolutely unnecessary to anyone.
775,NA,2023-04-17T13:20:10Z,00:39,00:45,We came there to save them from the regime under which they were.
775,NA,2023-04-17T13:20:10Z,00:45,00:53,"I'm sorry, the last question. I did not see about the career. I have no career, so it is impossible to destroy it."
775,NA,2023-04-17T13:20:10Z,00:53,01:01,"But taking into account the good relationship with the Mesh channel, tell me how to answer, I will be happy to play along."
775,NA,2023-04-17T13:20:10Z,01:01,01:13,"For example, I will say that ""Oh, horror, horror, I feel with my fingertips how my career is destroying me."""
775,NA,2023-04-17T13:20:10Z,01:13,01:15,*Subscribe*
773,NA,2023-04-17T12:52:06Z,00:00,00:11,"Absolutely right. I have said many times that the Ministry of Defense has accepted our flanks, and the flanks are the area of responsibility of the Ministry of Defense."
772,NA,2023-04-17T12:52:06Z,00:00,00:17,"So, the ratio of the number of the enemy to the number of shells that need to be used and the number of sanitary losses depends on the number of shells that are not received."
772,NA,2023-04-17T12:52:06Z,00:17,00:29,"We take very conditionally shells over 120 mm caliber. I repeat again, the numbers are extremely conditional and can only emphasize the order."
772,NA,2023-04-17T12:52:06Z,00:29,00:52,"For example, around Artemovsk 80,000 Ukrainian soldiers, of which 30,000 are directly in trenches around, which, in fact, do not need to be destroyed. 30,000 Ukrainian soldiers, to contain, destroy and exert enough pressure on them in order to move plus or minus 100-200 meters per day,"
772,NA,2023-04-17T12:52:06Z,00:52,01:13,"6,000 shells are required. If 3,000 shells are given, then 3,000 is not enough. If there are 6,000 shells per day, then, for example, our sanitary losses will be 20 people per day, irrecoverable, and 40 people per day, wounded, 300."
772,NA,2023-04-17T12:52:06Z,01:13,01:36,"And the loss of the enemy will be about 500 people. If the number of shells is twice as small, then our losses, very conditional, will be 120 people per day, wounded - 240 people per day, and the loss of the enemy will be about 300 people per day."
772,NA,2023-04-17T12:52:06Z,01:36,01:51,"Thus, the missing shells in the amount of 3,000 pieces increase by 0.02 per 100 people, by 0.03 per 200 people. Here, in fact, elementary arithmetic that must be adhered to."
767,#1476,2023-04-17T10:14:41Z,00:00,00:14,"Today, a group of young guys from the city of ""Peremen"" has posted a petition on their Telegram channel for the removal of Governor Beglov from office."
767,#1476,2023-04-17T10:14:41Z,00:14,00:31,"In St. Petersburg, there are men and women, there are old people and young people, there are liberals and radical patriots, but they all have the same opinion - Beglov has no place in St. Petersburg."
767,#1476,2023-04-17T10:14:41Z,00:31,00:42,"And so I think - well done guys! I am for the removal of Beglov, and I ask everyone to support their petition."
761,#1470,2023-04-15T18:33:04Z,00:00,00:12,"I will say figuratively - when a person is shit, then do not think that shit will stick to him, he is shit himself."
757,NA,2023-04-15T13:51:18Z,00:00,00:18,"This is the state of the depths that I talked about yesterday. Some die in order to tear off this flag, and others, trampling on their bodies and spitting in their closed eyes, hang it and glorify it."
755,#1467,2023-04-15T10:16:24Z,00:00,00:15,"The article is called ""Only fair fight and no agreement"" - that's what's important. And plus - the state of the depths, which can interfere with the fair fight. This is the basis of the article."
753,NA,2023-04-14T10:33:50Z,00:00,00:12,"I saw a report by Evgeny Poddumny, in which the musicians and orchestras are talking. You can call them balalaikas, composers, anyone. As they say, only in the oven did not put."
753,NA,2023-04-14T10:33:50Z,00:12,00:32,"ChVK Wagner - write down, is called Wagner, because Dmitry Utkin founded ChVK Wagner, was the first person who took up arms and went to protect the interests of Russia in the ranks of a new structure, which after that began to protect the interests of Russia everywhere."
753,NA,2023-04-14T10:33:50Z,00:32,00:49,"Therefore, ChVK Wagner. As for the mention, if there is a ban on the federal channels, you can not call it at all, what's the difference? Someone is, somewhere goes. Around, in the end, paratroopers and all the rest."
753,NA,2023-04-14T10:33:50Z,00:49,00:58,"Therefore, why argue about it? And if you want to figure out who was there, who was called, ask Evgeny Poddumny, I do not know, maybe he knows better."
750,NA,2023-04-13T16:26:53Z,00:00,00:11,"Today I was going to a meeting, just on the leaked American document, including with the intelligence officials of ChVK Wagner and analysts who are engaged in the United States of America."
750,NA,2023-04-13T16:26:53Z,00:11,00:19,We draw the following conclusions. This document is the last Nanai-American warning.
750,NA,2023-04-13T16:26:53Z,00:19,00:31,"It was leaked deliberately in order to ask certain questions. I think that about this, those colleagues who participated with me in the meeting, in the near future, will give a more detailed layout."
750,NA,2023-04-13T16:26:53Z,00:31,00:54,"Now, about the killed and wounded. We entered into combat on March 19, 1922. From the first day of the fighting, to this day, our assessment of the destroyed enemy, only a load of 200, that is, killed without return losses, 38 thousand people."
750,NA,2023-04-13T16:26:53Z,00:54,01:02,"Of which 32 thousand people are on the Bakhmut, Solidar and the surrounding area, when the Bakhmut is blocked."
750,NA,2023-04-13T16:26:53Z,01:02,01:03,Bakhmut.
748,#1462,2023-04-13T13:42:56Z,00:00,00:06,"I don't know what a black list is, I know that the pirates had a black mark."
748,#1462,2023-04-13T13:42:56Z,00:06,00:16,"There is such an anecdote, when one pirate comes to another and says in a comment ""blue mark"", do you know what it is?"
748,#1462,2023-04-13T13:42:56Z,00:16,00:19,"He says, ""not black, but also nothing good."""
748,#1462,2023-04-13T13:42:56Z,00:19,00:28,"Therefore, we include the EU in the blue list and give it a blue mark."
746,#1460,2023-04-13T11:57:41Z,00:01,00:09,"I don't know what is happening in the Canary Islands or in New York, I clearly know what is happening in Artyomovsk, he is Bakhmut."
746,#1460,2023-04-13T11:57:41Z,00:09,00:16,The EU continues to pull up reserves and transfer them to the city line.
746,#1460,2023-04-13T11:57:41Z,00:16,00:20,The hardest bloody battles are underway.
746,#1460,2023-04-13T11:57:41Z,00:20,00:32,"Therefore, it is too early to talk about the complete encirclement of Bakhmut. 80% of Bakhmut is under our control."
746,#1460,2023-04-13T11:57:41Z,00:32,00:37,The remaining parts are resisting persistently.
745,#1459,2023-04-13T11:43:14Z,00:00,00:06,"There is such an anecdote, which ends with the phrase ""so big, but you believe in fairy tales."""
745,#1459,2023-04-13T11:43:14Z,00:06,00:18,"Therefore, the political scientist Ischenko and other very positive, kind guys, they may be the best analysts in the world, military."
745,#1459,2023-04-13T11:43:14Z,00:18,00:26,"But I believe that it is better to prepare for the worst, especially since all the trends are already there."
745,#1459,2023-04-13T11:43:14Z,00:26,00:30,"And who sees how many people, I can say this."
745,#1459,2023-04-13T11:43:14Z,00:30,00:36,Tell me who in our country has intelligence satellites except for the Chevrolet Cavadier.
745,#1459,2023-04-13T11:43:14Z,00:36,00:50,"And therefore, we see 200,000 Ukrainian reserves, but 60,000 fleeing Ukrainian soldiers in fear, we do not see yet."
745,#1459,2023-04-13T11:43:14Z,00:50,00:50.500,Let's go.
744,#1458,2023-04-13T10:34:13Z,00:00,00:09,I have already said that no one identifies ChVK Vagner or Bakhmut in the video.
744,#1458,2023-04-13T10:34:13Z,00:09,00:16,"As for Osechkin, Osechkin is an absolute asshole and a fucking moron."
744,#1458,2023-04-13T10:34:13Z,00:16,00:27,"And as for Andrey Medvedev, I have already said that this scum that spent two days in ChVK Vagner and who the fuck can it identify?"
744,#1458,2023-04-13T10:34:13Z,00:27,00:33,This scum of Andrey Medvedev can identify someone.
744,#1458,2023-04-13T10:34:13Z,00:33,00:35,Sorry for my French.
744,#1458,2023-04-13T10:34:13Z,00:35,00:39,"Therefore, the nonsense is absolutely complete."
744,#1458,2023-04-13T10:34:13Z,00:39,00:43,It does not correspond to reality.
744,#1458,2023-04-13T10:34:13Z,00:43,00:45,I answer your question directly.
743,#1457,2023-04-12T14:05:00Z,00:00,00:04,Why do I constantly talk about mobilization of society?
743,#1457,2023-04-12T14:05:00Z,00:04,00:09,"Because not only those who are mobilized should be mobilized, those who go to the front."
743,#1457,2023-04-12T14:05:00Z,00:09,00:20,"The whole society should be mobilized, starting with ordinary workers or village workers who are ready for this process."
743,#1457,2023-04-12T14:05:00Z,00:20,00:31,"And when we travel through the regions of our recruiters, they see that people are ready to mobilize and understand that there is a war for the very existence of Russia."
743,#1457,2023-04-12T14:05:00Z,00:31,00:35,Officials are certainly not ready to mobilize.
743,#1457,2023-04-12T14:05:00Z,00:35,00:38,"And we see it everywhere, they do not change."
743,#1457,2023-04-12T14:05:00Z,00:38,00:51,"Look how many officials we had who are not just against the war today, but who fled Russia and got a whole state out of it."
743,#1457,2023-04-12T14:05:00Z,00:51,00:58,"Chubais, Dvorkovich, those who fled because they did not support the war between Russia and the West."
743,#1457,2023-04-12T14:05:00Z,00:58,01:05,Those who fled because they just decided to find a way to get out of their state.
743,#1457,2023-04-12T14:05:00Z,01:05,01:08,They are happily accepted abroad.
743,#1457,2023-04-12T14:05:00Z,01:08,01:19,"And a huge number of those who remained in Russia because they cannot just pull out and take away what they want to take away, and therefore wait for some moment."
743,#1457,2023-04-12T14:05:00Z,01:19,01:30,Most of the current officials and the official elite around them are sitting quietly and thinking about how something would happen.
743,#1457,2023-04-12T14:05:00Z,01:30,01:35,But the most difficult and the most terrible thing for them is to change the system.
743,#1457,2023-04-12T14:05:00Z,01:35,01:38,They are all elements of this system.
743,#1457,2023-04-12T14:05:00Z,01:38,01:45,"And therefore, when you start shaking this system, it is very, very toxic for them."
743,#1457,2023-04-12T14:05:00Z,01:45,01:50,The main thing in this system is the position you are in.
743,#1457,2023-04-12T14:05:00Z,01:50,01:57,"Ideology, the country, the future of this country, are the least interested in these people."
743,#1457,2023-04-12T14:05:00Z,01:57,02:02,"And therefore, Dvorkovich is a vivid, brightest example of this."
743,#1457,2023-04-12T14:05:00Z,02:02,02:05,Dvorkovich is a piece of paper.
743,#1457,2023-04-12T14:05:00Z,02:05,02:10,Dvorkovich was one of the closest people to Medvedev.
743,#1457,2023-04-12T14:05:00Z,02:10,02:22,"Dvorkovich held various positions in various sectors of the economy, and the most closed decisions were made through him to this day."
743,#1457,2023-04-12T14:05:00Z,02:22,02:31,"Who should be responsible for him going crazy somewhere in Israel, Spain, or wherever else he managed to escape?"
743,#1457,2023-04-12T14:05:00Z,02:31,02:35,Why was he released? Why didn't anyone pay attention to this?
743,#1457,2023-04-12T14:05:00Z,02:35,02:39,"And people like Dvorkovich, I have hundreds of people on my list."
743,#1457,2023-04-12T14:05:00Z,02:39,02:41,Why are we silent about this?
743,#1457,2023-04-12T14:05:00Z,02:41,02:54,"Why don't we want to clean up this anthill that has been created over the years and which over the years has turned into a community of people who are ready to develop something in this country,"
743,#1457,2023-04-12T14:05:00Z,02:54,02:59,a community of people who are only interested in their own well-being.
743,#1457,2023-04-12T14:05:00Z,02:59,03:04,And how many more such people are inside the system?
743,#1457,2023-04-12T14:05:00Z,03:04,03:08,The system requires global sanitation.
743,#1457,2023-04-12T14:05:00Z,03:08,03:15,The system requires sanitation and a reduction in the number of participants in this bureaucratic community.
743,#1457,2023-04-12T14:05:00Z,03:15,03:27,"Those who are in the system are divided into those who fled, those who fled continue to get rich, and those who just get rich but have not fled yet."
741,#1455,2023-04-12T11:10:38Z,00:01,00:03,I watched this video.
741,#1455,2023-04-12T11:10:38Z,00:03,00:18,"It's bad when it cuts off people's heads, but I have not found anywhere that this is happening under the guise of a bang, and the fighters of the ChVK ""Wagner"" are participating in the execution."
740,#1454,2023-04-12T10:28:39Z,00:00,00:03,"I have been dealing with the recruitment of new fighters of the ChVK ""Wagner""."
740,#1454,2023-04-12T10:28:39Z,00:03,00:15,"All over the country, all regions actively support the recruitment, helping to place advertising and helping in absolutely everything that we need."
740,#1454,2023-04-12T10:28:39Z,00:15,00:18,There are two regions that are an exception.
740,#1454,2023-04-12T10:28:39Z,00:18,00:31,"This is the Yaroslavl region, where for some reason we were told that the team came from the very top, poking their finger into space, to remove all the advertising."
740,#1454,2023-04-12T10:28:39Z,00:31,00:33,And also St. Petersburg.
740,#1454,2023-04-12T10:28:39Z,00:33,00:37,"St. Petersburg is already a disease, it's a clinic."
740,#1454,2023-04-12T10:28:39Z,00:37,00:49,"This is a huge number of officials, officials-bastards, who are trying in any way to harm any patriotic moves."
740,#1454,2023-04-12T10:28:39Z,00:49,00:52,"Therefore, the police capture their registry office."
740,#1454,2023-04-12T10:28:39Z,00:52,00:59,"Therefore, the advertising of the ChVK ""Wagner"" is completely and totally prohibited in the city of St. Petersburg."
740,#1454,2023-04-12T10:28:39Z,00:59,01:09,"Comrade Beglov, open your eyes, bitch, and make a decision. Are you for Russia, mother, or against it?"
740,#1454,2023-04-12T10:28:39Z,01:09,01:15,"Therefore, we will pour advertising with our brains through the Prosecutor General's Office in the city of St. Petersburg."
740,#1454,2023-04-12T10:28:39Z,01:15,01:16,to the city of St. Petersburg.
739,#1453,2023-04-12T09:56:15Z,00:01,00:05,There are constantly questions about the ChNPP.
739,#1453,2023-04-12T09:56:15Z,00:05,00:10,"In fact, the ChNPP ""Wagner"" has never been a ChNPP. Never."
739,#1453,2023-04-12T09:56:15Z,00:10,00:15,"I have already said, there was a battalion-tactical group ""Wagner"","
739,#1453,2023-04-12T09:56:15Z,00:15,00:20,"after that, its general Korotkov called the ChNPP,"
739,#1453,2023-04-12T09:56:15Z,00:20,00:21,"and the ChNPP ""Wagner"" began."
739,#1453,2023-04-12T09:56:15Z,00:21,00:26,"The ChNPP ""Wagner"" is the same as any commercial structure,"
739,#1453,2023-04-12T09:56:15Z,00:26,00:29,the structure is aimed at making money.
739,#1453,2023-04-12T09:56:15Z,00:29,00:32,"The ChNPP ""Wagner"" has never earned money."
739,#1453,2023-04-12T09:56:15Z,00:32,00:41,It has always been a defender of the interests of the Russian Federation in different directions for my funds.
739,#1453,2023-04-12T09:56:15Z,00:41,00:47,"No one before me and the ChNPP ""Wagner"" set such tasks."
739,#1453,2023-04-12T09:56:15Z,00:47,00:53,"No matter how much gossip there was about the tasks set by the Ministry of Defense, the State Defense, or so on."
739,#1453,2023-04-12T09:56:15Z,00:53,00:57,We ourselves chose who to protect and protected.
739,#1453,2023-04-12T09:56:15Z,00:57,01:02,Today they protect the interests of the Russian Federation in Ukraine.
739,#1453,2023-04-12T09:56:15Z,01:02,01:10,"The ChNPP is a commercial structure, and therefore the ChNPP ""Wagner"", the ChNPP ""Wolves"", and so on,"
739,#1453,2023-04-12T09:56:15Z,01:10,01:14,"and the like, are structures that can, like the ChNPP,"
739,#1453,2023-04-12T09:56:15Z,01:14,01:18,engage in security of anything and anywhere.
739,#1453,2023-04-12T09:56:15Z,01:18,01:24,"And the salaries that are rumored to be there in the ChNPP ""Gazprom"","
739,#1453,2023-04-12T09:56:15Z,01:24,01:30,"the ChNPP ""Gazprom"" - 500 thousand rubles salary for a fighter - for God's sake!"
739,#1453,2023-04-12T09:56:15Z,01:30,01:35,"Another thing, the question is whether a fighter wants to fight if he has received such money for one month,"
739,#1453,2023-04-12T09:56:15Z,01:35,01:39,or it is easier for him to live a year calmly on the first salary.
739,#1453,2023-04-12T09:56:15Z,01:39,01:44,"The ChNPP ""Wagner"" is a private army,"
739,#1453,2023-04-12T09:56:15Z,01:44,01:54,"it is private only because it is managed by people without bureaucracy, without bubbles,"
739,#1453,2023-04-12T09:56:15Z,01:54,01:59,"which is typical of any private structure, including a business structure."
739,#1453,2023-04-12T09:56:15Z,01:59,02:02,"Therefore, the ChNPP ""Wagner"" is effective."
739,#1453,2023-04-12T09:56:15Z,02:02,02:07,"The ChNPP ""Wagner"" has planes, helicopters, all-caliber artillery,"
739,#1453,2023-04-12T09:56:15Z,02:07,02:16,"the ChNPP ""Wagner"" has air defense, and everything else, including satellites and other high-tech things."
739,#1453,2023-04-12T09:56:15Z,02:16,02:18,"Therefore, we are effective."
739,#1453,2023-04-12T09:56:15Z,02:18,02:23,"We are a community of like-minded people, a combat brotherhood,"
739,#1453,2023-04-12T09:56:15Z,02:23,02:29,"which is aimed at entering history for centuries as great warriors,"
739,#1453,2023-04-12T09:56:15Z,02:29,02:33,who were able to prove the strength of Russian weapons.
739,#1453,2023-04-12T09:56:15Z,02:33,02:40,"And the rest of the story - you want to make money, you want to wear a beautiful ribbon - it's not for us, guys."
739,#1453,2023-04-12T09:56:15Z,02:40,02:44,"It's further, all the same ChNPPs that you are talking about."
739,#1453,2023-04-12T09:56:15Z,02:44,02:44.500,Bye.
738,#1452,2023-04-11T17:20:53Z,00:00,00:05,"If I knew this news from you, it would be terrible."
738,#1452,2023-04-11T17:20:53Z,00:05,00:08,The strike is almost below the waist.
738,#1452,2023-04-11T17:20:53Z,00:08,00:12,I would say the strike is significantly below the heels.
737,NA,2023-04-11T17:01:18Z,00:00,00:11,"As for the tattoos of Dmitry Utkin, which you love to discuss, you need to know the rules."
737,NA,2023-04-11T17:01:18Z,00:11,00:22,"When you do a tattoo contest, sometimes a person with a small dot on the extreme flesh can come."
737,NA,2023-04-11T17:01:18Z,00:22,00:29,"And if you suck this object, you will see that there is a map of the Moscow subway."
737,NA,2023-04-11T17:01:18Z,00:29,00:43,"This is a piece of advice for the guys who were investigating from the center of the dossier, here they are telling me."
737,NA,2023-04-11T17:01:18Z,00:43,00:53,"Therefore, if you want to check something, suck it."
736,NA,2023-04-11T17:01:18Z,00:01,00:05,"If you watched the film ""17 moments of spring"","
736,NA,2023-04-11T17:01:18Z,00:05,00:08,"there is a colonel Isaev,"
736,NA,2023-04-11T17:01:18Z,00:08,00:11,"in the role of Stirlitz,"
736,NA,2023-04-11T17:01:18Z,00:11,00:16,was forced to do the same
736,NA,2023-04-11T17:01:18Z,00:16,00:20,certain actions
736,NA,2023-04-11T17:01:18Z,00:20,00:24,that were associated with the symbolism of the Third Reich.
736,NA,2023-04-11T17:01:18Z,00:24,00:29,"In order to defeat Nazism,"
736,NA,2023-04-11T17:01:18Z,00:29,00:33,it is necessary to try it on.
736,NA,2023-04-11T17:01:18Z,00:33,00:38,Dmitry Utkin tries on Nazism
736,NA,2023-04-11T17:01:18Z,00:38,00:40,to himself.
736,NA,2023-04-11T17:01:18Z,00:40,00:42,[References]
723,NA,2023-04-10T07:50:42Z,00:00,00:11,"Vladlen Tatarsky served the people. The division between the people and the so-called ""elite"" is getting bigger and bigger."
723,NA,2023-04-10T07:50:42Z,00:11,00:18,We have practically no elite except for the official and around the official.
723,NA,2023-04-10T07:50:42Z,00:18,00:26,"Therefore, my opinion, maybe it sounds a little rude, is to shit on the officials."
723,NA,2023-04-10T07:50:42Z,00:26,00:38,"Whether there are Tatars or not. Moreover, they are already beginning to be disappointed by the existence of such as the Tatars and many others, including me."
723,NA,2023-04-10T07:50:42Z,00:38,00:44,Those who are now fighting for Russia's mother.
