id,prigozhin_id,datetime,from,to,text
1126,#1742,2023-06-02T17:57:15Z,02:06,02:27,"If you want to take part in the punishment of these people, please contact the ChVK Vagner training center. We will be grateful to you for any information that you will post regarding such monstrous cases as this one,"
1126,#1742,2023-06-02T17:57:15Z,02:27,02:50,"where we find out from the employee's mobile phone whether the amount of 13 thousand rubles was transferred at his request or not. I take this opportunity to thank the fighters of ChVK Vagner, present and future, who look into the information resources of Ksenia Anatolievna Sobchak."
1126,#1742,2023-06-02T17:57:15Z,02:50,03:07,"Guys, sign up for ChVK Vagner. If you have 13 thousand rubles stolen in the training center, we will immediately find the culprit and return you the money. By the way, even if we don't find the culprit."
1126,#1742,2023-06-02T17:57:15Z,03:07,03:09,[References]
1124,#1740,2023-06-02T16:22:55Z,00:00.500,00:09,"At the moment, on June 2, almost all, 99% of the ChVK-Wagner units left Bakhmut."
1124,#1740,2023-06-02T16:22:55Z,00:09,00:17,"All positions are transferred in proper order to the Ministry of Defense, there are no questions or comments."
1124,#1740,2023-06-02T16:22:55Z,00:17,00:26,"As for provocations, from the side of the USSR, today, provocations are not observed in our address."
1124,#1740,2023-06-02T16:22:55Z,00:26,00:32,"However, it should be noted that surprises awaited us on the other side."
1124,#1740,2023-06-02T16:22:55Z,00:32,00:40,"Shortly before our departure, we discovered suspicious activity on the routes of our movement."
1124,#1740,2023-06-02T16:22:55Z,00:40,00:54,"As part of the discovery of this suspicious activity, we called law enforcement agencies and began to investigate the routes of our departure along the roads."
1124,#1740,2023-06-02T16:22:55Z,00:54.500,01:13,"We found about a dozen places where various provocation devices were placed, starting with hundreds of anti-tank mines and ending with tons of plastic charges from the so-called ""Gorynych snakes""."
1124,#1740,2023-06-02T16:22:55Z,01:13.500,01:25.500,"All this was under control, while we carried out several actions, again, in conjunction with law enforcement agencies, in order to document everything."
1124,#1740,2023-06-02T16:22:55Z,01:25.500,01:34.500,"Now, the investigation is underway. Those who laid these charges were representatives of the Ministry of Defense."
1124,#1740,2023-06-02T16:22:55Z,01:35,01:44.500,"The question is, why did you do it? They point their fingers up, but do not answer the question."
1124,#1740,2023-06-02T16:22:55Z,01:44.500,01:53.500,"These charges were not necessary to lay in order to hold the enemy, since they are in the rear zone."
1124,#1740,2023-06-02T16:22:55Z,01:53.500,02:04.500,"Therefore, it can be assumed that these charges were intended to cut the advancing divisions of the ChVK ""Wagner"", although we do not walk in columns."
1124,#1740,2023-06-02T16:22:55Z,02:04.500,02:18,"In fact, all in all and in good condition, no one was hurt. We assume that this was an attempt to public corruption."
1124,#1740,2023-06-02T16:22:55Z,02:18,02:20,Thank you.
1123,#1739,2023-06-02T15:50:41Z,00:00.500,00:18.500,"Type FM. Every fighter of the ChVK ""Wagner"", when he goes to the battle, he fills a special form, in which it is written who to give money in case of his death and where to bury."
1123,#1739,2023-06-02T15:50:41Z,00:19,00:30.500,"In this form there are two recipients, the first and the second. In the event of the death of the first recipient, his death or impossibility to transfer, is transferred to the second."
1123,#1739,2023-06-02T15:50:41Z,00:30.500,00:38.500,"Therefore, in this case, he decided to transfer the money to his grandfather."
1123,#1739,2023-06-02T15:50:41Z,00:39,00:53.500,"If he owed the amount of elements, then it is necessary to solve in the established law of order. All money they get in black cash, and you can publish it."
1123,#1739,2023-06-02T15:50:41Z,00:54,01:06.500,"People from the zone went to fight, so that the people of the Russian Federation sat at home by the stoves and warmed up, and they died for this black cash."
1123,#1739,2023-06-02T15:50:41Z,01:06.500,01:19.500,"Who wants to dispute this situation, as usual, the gun in hand, the territory behind the ""Bahmut"" is still free. Get ready, organize and forward."
1122,#1738,2023-06-02T15:19:55Z,00:00,00:14.500,"The answer for the branch on the network. Since the opening of the centers for the selection of the ChVK ""Wagner"", in the zone of the ChVK ""Wagner"" went a little more than 300 people."
1122,#1738,2023-06-02T15:19:55Z,00:14.500,00:28.500,"The guys show good combat qualities and fight well, and in fact, I can not say that someone is fighting from some territories of the Russian Federation badly."
1122,#1738,2023-06-02T15:19:55Z,00:29,00:49.500,"About the former prisoners. Since the Kirov region has a large density of camps, I will not raise the exact numbers, I think that about 800-900 people are those who arrived from the Kirov region to the SVO zone."
1122,#1738,2023-06-02T15:19:55Z,00:50,00:59.500,And also they showed a high level of combat qualities and courage and courage.
1121,#1737,2023-06-02T13:00:25Z,00:01,00:14.500,"Ivan, you did the right thing to contact us for two reasons. First, we will certainly help you to leave for the territory of hostilities and we will invite you."
1121,#1737,2023-06-02T13:00:25Z,00:14.500,00:24.500,"And the second, now everyone will understand that the ""Wagner"" orchestra is not our subsidiary affiliated media."
1120,#1736,2023-06-02T11:55:23Z,00:01,00:12.500,"I will certainly visit many cities, but we will not name the dates now and we will not be tied to the dates."
1120,#1736,2023-06-02T11:55:23Z,00:12.500,00:22.500,"There is a serious work in the SVO zone today. Despite the fact that we are leaving and have already left Bakhmut, there are a lot of tasks."
1120,#1736,2023-06-02T11:55:23Z,00:23,00:30.500,"Therefore, I apologize, but we will do it a little later. Thank you for your question."
1118,#1735,2023-06-02T11:26:00Z,00:01,00:20.500,"Due to the fact that I was on a trip and returned from the SVO zone late in the evening on June 1, 1923, I personally signed and personally delivered documents to the post office, which are called ""Declaration of Crime""."
1118,#1735,2023-06-02T11:26:00Z,00:21,00:38.500,"Two receipts for two people and a group of unidentified persons. Therefore, scans that can be transmitted in order not to disclose all the details, I send, you can publish them."
1117,#1734,2023-06-02T09:17:38Z,00:00,00:22.500,"Undoubtedly, opinion leaders are very important in order to make the authorities move. Despite the fact that people are dying in the border areas and the country is in danger, the authorities are not doing anything necessary to prevent this from happening."
1117,#1734,2023-06-02T09:17:38Z,00:23,00:40.500,"And the authorities remain in their bureaucratic corruption. Therefore, opinion leaders are very important. The only thing I would argue with is the subscribers of the Telegram channels. People from different regions, different regions and not always people who can hold weapons in their hands."
1117,#1734,2023-06-02T09:17:38Z,00:41,00:59.500,"Therefore, if you look at my proposals for the protection of the borders, then of course the people should participate in this. And mostly those people who are in places of residence not far from the place of service, so that it is more convenient for them to defend their land."
1117,#1734,2023-06-02T09:17:38Z,01:00,01:12.500,"And opinion leaders, in their opinion, should participate in this. For this, we created the ChVK ""Wagner"" ""Second Front"", so that all the indifferent are not afraid to express their opinion."
1117,#1734,2023-06-02T09:17:38Z,01:13,01:36.500,"And we will not allow certain repressions to follow, especially from the side of the administration of the President, who will try to force the law enforcement agencies to react. But if you do it within the framework of the law, then this must be done. Otherwise, we will float along the current until history takes us into the sewage."
1116,#1733,2023-06-02T09:04:52Z,00:01,00:27.500,"The answer to your question for the ""72.ru"" channel. I will certainly get to Tyumen someday, but the cities that I visited were not press conferences, this is a mistake. These were meetings with our information partners, which you specially posted in the open access, those parts that they considered necessary for society to know what we are discussing."
1116,#1733,2023-06-02T09:04:52Z,00:28,00:32,"Therefore, the press conference has not yet been discussed."
1111,NA,2023-06-01T14:44:26Z,00:01,00:21,"In any case, in order to avoid any ambiguity, these are two videos in which it is absolutely clear, word for word, in video format, what I said about the AHMAD units during my trip."
1111,NA,2023-06-01T14:44:26Z,00:22,00:41,"I do not see anything prejudicial. This is the first. And the second, as regards the need to introduce a death penalty and punishment for the mistakes of the top officials of the Ministry of Defense,"
1111,NA,2023-06-01T14:44:26Z,00:42,00:52,"and in addition to the death of the personnel and other problems of the Ministry of Defense, this is my opinion, and I will continue to insist on it."
1111,NA,2023-06-01T14:44:26Z,00:52,01:05,"As for my location, all participants in the discussion know perfectly well that my, including closed, special phones have the opportunity to contact me."
1103,#1724,2023-05-31T18:21:01Z,00:00,00:17,I answer the CNN and other media press conferences. There was no press conference. Media Housing Patriot gathered its partners in the region.
1103,#1724,2023-05-31T18:21:01Z,00:18,00:34,"This is a closed event, which our partners come to, with whom we communicate how to better bring an honest agenda for the population of the Russian Federation on what is happening."
1103,#1724,2023-05-31T18:21:01Z,00:35,00:51,"On the one hand, we must not stir up panic, and on the other hand, we must mobilize society, and not disperse it, as is now done in some, including federal media."
1103,#1724,2023-05-31T18:21:01Z,00:52,01:09,"We are preparing for a long-term war, and therefore CNN does not get there, except with one condition, if CNN will clearly take our agenda and bring it to the world community, all that we ask."
1103,#1724,2023-05-31T18:21:01Z,01:10,01:26,"I can give the first theses. In these first theses for CNN, the first will be that Russia must be respected. If you do not respect, we will tear the ass where only possible. The army will not be able to do it."
1102,#1723,2023-05-31T17:53:01Z,00:00,00:19,"I believe that the point of the acceptable escalation of the conflict with the West will soon be brought closer, and it will be a serious, full-scale conflict in which we will have to defend ourselves, if we analyze how things are going now."
1102,#1723,2023-05-31T17:53:01Z,00:20,00:37,"The second is the conflict. I am sure that the seizure of Kiev will not end, again, analyzing the situation in which the current state of affairs is, and we will not have to shake hands at the summit for a long time."
1102,#1723,2023-05-31T17:53:01Z,00:38,00:53,"I have said many times, we must understand that from the point of view of communication with all the rest, we will be like North Korea. From the point of view of the standard of living, of course, this is a higher order, because we have everything on the territory that we need."
1101,#1722,2023-05-31T17:24:33Z,00:00,00:17,My trip is nothing more than a meeting with partner organizations. And the format of the conversation is more like political information and planning of further joint events.
1101,#1722,2023-05-31T17:24:33Z,00:18,00:34,"If such a format is to be learned to ban, although there is no legislative basis for this, then there should be a much more substantial legislation than in North Korea and somewhere else."
1101,#1722,2023-05-31T17:24:33Z,00:35,00:55,"When the population will have a question, ""Kids, what are you hiding? Maybe you are growing us on biomass or organs and doing your own business and somehow planning your life, so you do not want us to know the truth?"""
1101,#1722,2023-05-31T17:24:33Z,00:56,01:11,"We live on two different planets. On the planet Earth, events are happening, and in the central media and TV channels, on the planet Moon, completely different events that do not even touch the system that exists."
1100,#1721,2023-05-31T15:47:50Z,00:00,00:10,"I think that Andrei Kovalev has said figuratively about Kiev, and Kiev should have been taken a little earlier, if it is taken."
1100,#1721,2023-05-31T15:47:50Z,00:11,00:31,"But as for the fact that we would have accomplished a huge number of tasks and achieved the most important thing, Russia would not be in the shame in which it is now due to low-qualified actions, structures that can be called near-military."
1099,#1720,2023-05-31T15:22:03Z,00:00,00:11.240,"I can not comment on where the Akhmatovs will be, I'm not immersed in these details, all the units keep them enough,"
1099,#1720,2023-05-31T15:22:03Z,00:11.240,00:14.040,Secrete normal situation during the war.
1099,#1720,2023-05-31T15:22:03Z,00:14.040,00:21.040,"As for the release of certain settlements, of course, I think that they have the strength for this,"
1099,#1720,2023-05-31T15:22:03Z,00:21.040,00:26.680,"they do not have the task of the entire DPR to be released, and Kadyrov, as I understand it, did not talk about it."
1099,#1720,2023-05-31T15:22:03Z,00:26.680,00:32.200,They will be engaged in certain areas in which they will act.
1099,#1720,2023-05-31T15:22:03Z,00:32.200,00:36.200,I do not see any flaws here.
1098,#1719,2023-05-31T13:48:04Z,00:00,00:09,"Yes, I talked to the governor of Leningrad region on the phone, he really advised how to make these payments,"
1098,#1719,2023-05-31T13:48:04Z,00:09,00:16.600,and gave contact persons who asked us for the list of residents of Leningrad region.
1098,#1719,2023-05-31T13:48:04Z,00:16.600,00:25,"We are now doing this in the process, no problems, we expect that everything that is promised will be done."
1097,#1718,2023-05-31T12:52:39Z,00:00.520,00:09,"Delevsky mentioned the number of 1.5 million, and I always say that it is necessary to mobilize about 2 million."
1097,#1718,2023-05-31T12:52:39Z,00:09,00:19,"1.5-3, which in total will be obtained, the difference is very small, because let's figure out what will be the aggression,"
1097,#1718,2023-05-31T12:52:39Z,00:19,00:27,"and how will the conflict in the territory of Ukraine be strengthened, and so on."
1097,#1718,2023-05-31T12:52:39Z,00:27,00:34,"Therefore, any number that can reflect the aggression of the enemy,"
1097,#1718,2023-05-31T12:52:39Z,00:34,00:39,"today I believe that it should be mobilized, taking into account the reserves of about 2 million people."
1097,#1718,2023-05-31T12:52:39Z,00:39,00:43,"This is my opinion, Delevsky's, it can be absolutely different."
1096,#1717,2023-05-31T11:54:07Z,00:01,00:09,Today I sent to the Investigative Committee and the Prosecutor's Office of the Russian Federation
1096,#1717,2023-05-31T11:54:07Z,00:09,00:20,"letters with a request to check on the fact of committing a crime during the preparation and in the course of the CISO,"
1096,#1717,2023-05-31T11:54:07Z,00:20,00:29,for a number of senior officials of the Ministry of Defense of the Russian Federation.
1096,#1717,2023-05-31T11:54:07Z,00:29,00:38,"These letters will not be published, because the media will deal with this."
1093,NA,2023-05-30T12:32:35Z,00:00,00:03,Answer to Anatoly Ushariov.
1093,NA,2023-05-30T12:32:35Z,00:03,00:08,"I can not know about the plans of the President, about the degree of his awareness,"
1093,NA,2023-05-30T12:32:35Z,00:08,00:18,"on my side, to the top management of the country, I bring all the problems that exist in the unpleasant form in which they are."
1093,NA,2023-05-30T12:32:35Z,00:18,00:25,"As for the blocking of information, including about ChVK Wagner and about the problems,"
1093,NA,2023-05-30T12:32:35Z,00:25,00:31,"my opinion is that today there is not in vain the expression ""Kremlin Tower"","
1093,NA,2023-05-30T12:32:35Z,00:31,00:41,"each tower tries to lobby its interests, and therefore any negative information that comes out,"
1093,NA,2023-05-30T12:32:35Z,00:41,00:53,"violates their usual life rhythm, and therefore they do it, in fact, they drive out bad thoughts from the house."
1093,NA,2023-05-30T12:32:35Z,00:53,00:59,"And when you drive out bad thoughts from the house, it is better to think,"
1093,NA,2023-05-30T12:32:35Z,00:59,01:04,"well, of course, if there is a conflict, that the enemy is a complete idiot, total."
1093,NA,2023-05-30T12:32:35Z,01:04,01:09,"Therefore, I am doing a lot of work with the media,"
1093,NA,2023-05-30T12:32:35Z,01:09,01:15,"in which I say that it is not necessary to write that the Russian tank destroyed 500 nationalists,"
1093,NA,2023-05-30T12:32:35Z,01:15,01:18,and they all ran away.
1093,NA,2023-05-30T12:32:35Z,01:18,01:24,"It is necessary to really approach this, otherwise we will think that we will disperse everyone with one tank."
1093,NA,2023-05-30T12:32:35Z,01:24,01:31,"And this is not so, indeed, the Ukrainian army is preparing, showing quite good results,"
1093,NA,2023-05-30T12:32:35Z,01:31,01:40,"and there is a pattern in any confrontation, it is better to treat the enemy,"
1093,NA,2023-05-30T12:32:35Z,01:40,01:46,"having exceeded expectations from him, than to think that he is a complete degenerate."
1093,NA,2023-05-30T12:32:35Z,01:46,01:51,"If you think that you are a degenerate, in any case you will lose the competition, whatever it is,"
1093,NA,2023-05-30T12:32:35Z,01:51,01:54,whether it is a sports competition or a war.
1091,#1713,2023-05-30T11:50:55Z,00:01,00:04,"I do not think that we need to make the people's militia,"
1091,#1713,2023-05-30T11:50:55Z,00:04,00:09,because the people's militia will immediately receive additional powers or will demand them.
1091,#1713,2023-05-30T11:50:55Z,00:09,00:14,Territorial defense is people who defend the territory on which they live.
1091,#1713,2023-05-30T11:50:55Z,00:14,00:22,"In the western part of the Moscow region, I believe that it is necessary to think about what to do in order to make it happen,"
1091,#1713,2023-05-30T11:50:55Z,00:22,00:27,"it is necessary to have a concept, it is necessary to have people who can do it,"
1091,#1713,2023-05-30T11:50:55Z,00:27,00:31,including those with a fairly large experience.
1091,#1713,2023-05-30T11:50:55Z,00:31,00:38,"And after that, it is desirable to implement it into life without fissures and bureaucracy."
1091,#1713,2023-05-30T11:50:55Z,00:38,00:39,- Thank you.
1090,NA,2023-05-30T08:20:10Z,00:01,00:05,- I am answering questions from Life.
1090,NA,2023-05-30T08:20:10Z,00:05,00:13,"- About mercenaries from the countries of Middle East and North Africa, I can't tell you anything."
1090,NA,2023-05-30T08:20:10Z,00:13,00:19,"- I have already answered this question, I am not aware of it. And, in fact, there are no mercenaries there."
1090,NA,2023-05-30T08:20:10Z,00:19,00:22,- That's why I don't know what the idea is.
1090,NA,2023-05-30T08:20:10Z,00:22,00:29,"- Now, as for drones in Moscow. Of course, I am aware of it, and of course, I am worried about it too."
1090,NA,2023-05-30T08:20:10Z,00:29.100,00:36,"- As a person who is somewhat familiar with this, I can tell you that many years ago it was necessary to engage in these programs."
1090,NA,2023-05-30T08:20:10Z,00:36,00:45,"- That now we are lagging behind our opponents for years, for years, and maybe for decades."
1090,NA,2023-05-30T08:20:10Z,00:45,00:52,"- But, in order to catch up with them, we are not doing anything at all."
1090,NA,2023-05-30T08:20:10Z,00:52,00:54,- I want to emphasize this.
1090,NA,2023-05-30T08:20:10Z,00:54.100,00:59,"- I am a specialist in this area, more or less, as a consumer of these problems."
1090,NA,2023-05-30T08:20:10Z,00:59,01:06,"- And now, as a citizen of the Russian Federation, I want to answer you in the following way."
1090,NA,2023-05-30T08:20:10Z,01:06,01:11,"- About drones, which are flying over Moscow and in Moscow."
1090,NA,2023-05-30T08:20:10Z,01:11,01:16,- You stinky creatures! What are you doing?! You are cattle!
1090,NA,2023-05-30T08:20:10Z,01:16,01:22,"- Tear your shit out of the offices, where you were imprisoned!"
1090,NA,2023-05-30T08:20:10Z,01:22.100,01:27,- You are destroying this country! You are the Ministry of Defense!
1090,NA,2023-05-30T08:20:10Z,01:27,01:37,- You did nothing to advance! What the fuck are you letting these drones arrive in Moscow?!
1090,NA,2023-05-30T08:20:10Z,01:37,01:43,"- The fact that they are flying to your home, to Rublyovka! And what the fuck is wrong with them?! Let your houses be rumbling!"
1090,NA,2023-05-30T08:20:10Z,01:43,01:50,"- And what should ordinary people do, when drones with explosives are crashing into their windows?!"
1090,NA,2023-05-30T08:20:10Z,01:50.100,02:03,"- As a citizen, I am deeply outraged, that these scum are calmly sitting and sitting on their fat shit, smeared with expensive creams."
1090,NA,2023-05-30T08:20:10Z,02:03,02:10,"- And that's why I think, that people have a complete right to ask them these questions, these scoundrels."
1090,NA,2023-05-30T08:20:10Z,02:10,02:14,- And I have warned about this many times.
1090,NA,2023-05-30T08:20:10Z,02:14.100,02:22,"- But nobody wants to listen. Because I am angry and upset with bureaucrats, who live in a magnificent way."
1088,#1711,2023-05-30T07:30:07Z,00:00,00:10,"I do not plan to attend religious holidays in June. I am a man who is not circumcised, although I respect religion."
1088,#1711,2023-05-30T07:30:07Z,00:10,00:21,"I spent $ 10 million on this temple, in one payment. Where did this money come from?"
1088,#1711,2023-05-30T07:30:07Z,00:21,00:32,"An African dictator thought that he owed me money, although there was no such agreement. And it was difficult for me to refuse this money."
1088,#1711,2023-05-30T07:30:07Z,00:32,00:44,"While I refused, we agreed that I would take it, but I spent it on some religious objects on the territory of the Russian Federation, for good purposes."
1088,#1711,2023-05-30T07:30:07Z,00:44,00:54,"I transferred this money to this temple, and we agreed not to report that I transferred it."
1088,#1711,2023-05-30T07:30:07Z,00:54,01:02,"But if this information has come out, I answer the question. And in principle, I wanted to remain incognito in this situation."
1087,#1710,2023-05-29T22:27:09Z,00:00,00:12,"If you have a university student, and he graduated even with a distinction, it does not mean that he can become a teacher, and even more so to organize his own university."
1087,#1710,2023-05-29T22:27:09Z,00:12,00:32,"As for the training of Belgorod and other border regions, the fighters of the ChVK ""Wagner"" are even experienced, even with medals and medals, it does not mean that they will properly train those who want to receive this knowledge."
1087,#1710,2023-05-29T22:27:09Z,00:32,00:49,"And even more so, they will create a training program, and even more so, they will organize people so that these people are able to properly engage in the security of the territory on which they are located as territorial defense."
1087,#1710,2023-05-29T22:27:09Z,00:49,00:59,"One of my employees from the Belgorod region, the hero of Russia, holds the leadership position of the ChVK ""Wagner"", visited one of the training centers."
1087,#1710,2023-05-29T22:27:09Z,00:59,01:21,"He saw that there is no discipline, training is held three hours a day, how many days, who came, how many came, and in addition to the lack of discipline, he saw that people sit on benches, on lawns, drink tea and various other drinks."
1087,#1710,2023-05-29T22:27:09Z,01:21,01:45,"If someone wants to learn, they come to Morkino, 12 hours a day, for a week or two, depending on the course, they prepare, after that they go home, but this does not mean that they have become full-fledged fighters of territorial defense, they have received the primary skills."
1087,#1710,2023-05-29T22:27:09Z,01:45,02:05,"Therefore, as for the Belgorod region, which we are now talking about, no one normally trains people, there is no organization, whose fault it is, the local authorities, the governor or the federal authorities, this is a separate story."
1087,#1710,2023-05-29T22:27:09Z,02:05,02:29,"But as for the fact that somewhere training is held, this is complete total nonsense. And as for the fighters of ChVK ""Wagner"", who help in training, I can tell you that the fighters from ChVK ""Wagner"" either leave for injury, or when they are removed from there, they fall into the black list."
1087,#1710,2023-05-29T22:27:09Z,02:29,02:41,"Therefore, do not think that you have good fighters running around the street, ChVK ""Wagner"", they are either at home for rehabilitation, or they are simply not very needed in ChVK ""Wagner""."
1087,#1710,2023-05-29T22:27:09Z,02:41,03:07,"As for the Belgorod region itself, I can say that a year ago I raised this issue and offered organizational assistance, of course, on an absolutely irrevocable basis, because the Belgorod region is our rear, the road of the enemy to the center of Russia."
1087,#1710,2023-05-29T22:27:09Z,03:07,03:28,"I was told that they are all right, they have the Ministry of Defense, the Ministry of Internal Affairs, the Federal Security Service, everyone who is necessary, they are able to protect their territory, everything they need, I emphasize, everything they need, they need funding from Moscow."
