id,prigozhin_id,datetime,from,to,text
957,#1613,2023-05-13T11:03:00Z,02:27.500,02:30.500,But they don't watch it because there is Prigozhin in the film.
957,#1613,2023-05-13T11:03:00Z,02:30.500,02:33.500,"If there was Shoyguly and Gerasimov in the film,"
957,#1613,2023-05-13T11:03:00Z,02:33.500,02:36.500,maybe this film would be educational.
957,#1613,2023-05-13T11:03:00Z,02:36.500,02:41.500,"Therefore, this is the situation that is not good for anything."
957,#1613,2023-05-13T11:03:00Z,02:41.500,02:46.500,The soldier is a soldier in Africa.
957,#1613,2023-05-13T11:03:00Z,02:46.500,02:50.500,"In order for a soldier to fight and not run away from the trenches,"
957,#1613,2023-05-13T11:03:00Z,02:50.500,02:52.500,"from under mortar fire,"
957,#1613,2023-05-13T11:03:00Z,02:52.500,02:56.500,you need to extinguish the mortars and manage all the units.
957,#1613,2023-05-13T11:03:00Z,02:56.500,02:59.500,"And we, unfortunately, for the last 10 years,"
957,#1613,2023-05-13T11:03:00Z,02:59.500,03:02.500,the managers have become unnecessary.
957,#1613,2023-05-13T11:03:00Z,03:02.500,03:07.500,"Those who bow low, low, low,"
957,#1613,2023-05-13T11:03:00Z,03:07.500,03:09.500,"in the presence of their bosses,"
957,#1613,2023-05-13T11:03:00Z,03:09.500,03:11.500,"and preferably on the chandelier,"
957,#1613,2023-05-13T11:03:00Z,03:11.500,03:13.500,"button up the back,"
957,#1613,2023-05-13T11:03:00Z,03:13.500,03:17.500,suddenly the boss will want to come up and warm up.
957,#1613,2023-05-13T11:03:00Z,03:17.500,03:20.500,"And so we have all the bastards cut out,"
957,#1613,2023-05-13T11:03:00Z,03:20.500,03:22.500,those who can make decisions.
957,#1613,2023-05-13T11:03:00Z,03:22.500,03:24.500,"And all these decisions,"
957,#1613,2023-05-13T11:03:00Z,03:24.500,03:26.500,"near-military bureaucracy,"
957,#1613,2023-05-13T11:03:00Z,03:26.500,03:29.500,"it just destroys everything,"
957,#1613,2023-05-13T11:03:00Z,03:29.500,03:31.500,it burns out.
957,#1613,2023-05-13T11:03:00Z,03:31.500,03:36.500,"The bureaucracy in the Russian Federation is the hardest cancerous tumor,"
957,#1613,2023-05-13T11:03:00Z,03:36.500,03:39.500,"which destroys everything, including the military."
957,#1613,2023-05-13T11:03:00Z,03:39.500,03:41.500,"Here is such an answer for you,"
957,#1613,2023-05-13T11:03:00Z,03:41.500,03:44.500,so as not to disclose secret information.
957,#1613,2023-05-13T11:03:00Z,03:44.500,03:46.500,The summary of this answer.
957,#1613,2023-05-13T11:03:00Z,03:46.500,03:49.500,"In this brainless war,"
957,#1613,2023-05-13T11:03:00Z,03:49.500,03:55.500,"the only saint and absolutely innocent in all the farts,"
957,#1613,2023-05-13T11:03:00Z,03:55.500,03:57.500,"this is a Russian soldier,"
957,#1613,2023-05-13T11:03:00Z,03:57.500,04:01.500,"who was thrown into the abyss of fate,"
957,#1613,2023-05-13T11:03:00Z,04:01.500,04:05.500,"and decided that he should die the way they like,"
957,#1613,2023-05-13T11:03:00Z,04:05.500,04:08.500,from their redwood offices.
957,#1613,2023-05-13T11:03:00Z,04:08.500,04:11.500,And so when this Russian soldier
957,#1613,2023-05-13T11:03:00Z,04:11.500,04:14.500,"will understand what is happening around,"
957,#1613,2023-05-13T11:03:00Z,04:14.500,04:16.500,"will raise his head,"
957,#1613,2023-05-13T11:03:00Z,04:16.500,04:20.500,"I am sure that he will figure out who is setting him up,"
957,#1613,2023-05-13T11:03:00Z,04:20.500,04:23.500,and will tear his ass to the fascist sign.
957,#1613,2023-05-13T11:03:00Z,04:23.500,04:26.500,Guilty of the tragedy
957,#1613,2023-05-13T11:03:00Z,04:26.500,04:28.500,he was abandoned.
957,#1613,2023-05-13T11:03:00Z,04:28.500,04:34.500,"I receive dozens, hundreds and thousands of letters"
957,#1613,2023-05-13T11:03:00Z,04:34.500,04:37.500,"from soldiers who say,"
957,#1613,2023-05-13T11:03:00Z,04:37.500,04:40.500,"""Let us be transferred to the CVK ""Wagner""."
957,#1613,2023-05-13T11:03:00Z,04:40.500,04:42.500,"They want to fight,"
957,#1613,2023-05-13T11:03:00Z,04:42.500,04:44.500,they are not allowed to do it.
956,NA,2023-05-13T10:13:21Z,00:01,00:04,And a little more post-scriptum.
956,NA,2023-05-13T10:13:21Z,00:04,00:14,"During the night, the ChVK unit ""Wagner"" continued their advance in the nest of Bakhmut and captured three more buildings."
955,#1612,2023-05-13T10:13:09Z,00:01,00:04,"I certainly cannot agree with the hostage,"
955,#1612,2023-05-13T10:13:09Z,00:04,00:08,because we are on different sides of the barricades.
955,#1612,2023-05-13T10:13:09Z,00:08,00:12,But the fact that he is unquestioningly praises
955,#1612,2023-05-13T10:13:09Z,00:12,00:16,"the head of the General Staff, Gerasimov,"
955,#1612,2023-05-13T10:13:09Z,00:16,00:18,"this is 100%,"
955,#1612,2023-05-13T10:13:09Z,00:18,00:22,"because, of course, the hostage is absolutely satisfied"
955,#1612,2023-05-13T10:13:09Z,00:22,00:26,what the head of the General Staff is doing today.
955,#1612,2023-05-13T10:13:09Z,00:26,00:31,"Russian troops leave their positions at the top,"
955,#1612,2023-05-13T10:13:09Z,00:31,00:36,"CVK ""Wagner"" does not receive enough shells,"
955,#1612,2023-05-13T10:13:09Z,00:36,00:42,"and, in fact, the potential of the Russian army is decreasing."
955,#1612,2023-05-13T10:13:09Z,00:42,00:44,"Therefore, the hostage,"
955,#1612,2023-05-13T10:13:09Z,00:44,00:47,"I think that he will not only praise soon,"
955,#1612,2023-05-13T10:13:09Z,00:47,00:50,but will also write some kind of state award
955,#1612,2023-05-13T10:13:09Z,00:50,00:52,"to those officials,"
955,#1612,2023-05-13T10:13:09Z,00:52,00:56,"which I want to underline ""near the military""."
955,#1612,2023-05-13T10:13:09Z,00:56,00:58,"""Near the military""."
955,#1612,2023-05-13T10:13:09Z,00:58,01:01,Because they can not be called military.
955,#1612,2023-05-13T10:13:09Z,01:01,01:03,Write some kind of state award
955,#1612,2023-05-13T10:13:09Z,01:03,01:06,in order to celebrate the merits before Ukraine.
955,#1612,2023-05-13T10:13:09Z,01:06,01:11,I got a funny SMS from one veteran of the General Staff of the Ministry of Internal Affairs
955,#1612,2023-05-13T10:13:09Z,01:11,01:15,which I will publish below.
955,#1612,2023-05-13T10:13:09Z,01:15,01:18,"In the same case, I want to say a few words"
955,#1612,2023-05-13T10:13:09Z,01:18,01:22,about the discrediting of the Ministry of Defense of the Russian army.
955,#1612,2023-05-13T10:13:09Z,01:22,01:25,Discrediting is an action
955,#1612,2023-05-13T10:13:09Z,01:25,01:29,aimed at undermining the trust
955,#1612,2023-05-13T10:13:09Z,01:29,01:33,to the army and the Ministry of Defense.
955,#1612,2023-05-13T10:13:09Z,01:33,01:36,Those who allowed
955,#1612,2023-05-13T10:13:09Z,01:36,01:39,"the state of the army and the Ministry of Defense,"
955,#1612,2023-05-13T10:13:09Z,01:39,01:41,"in which they are today,"
955,#1612,2023-05-13T10:13:09Z,01:41,01:44,are just engaged in discrediting.
953,#1610,2023-05-12T18:49:00Z,00:01,00:03,"While I was moving,"
953,#1610,2023-05-12T18:49:00Z,00:03,00:07,"the ChVK-Wagner units took another 40,000 meters,"
953,#1610,2023-05-12T18:49:00Z,00:07,00:11,"moving up to 200 meters in various directions,"
953,#1610,2023-05-12T18:49:00Z,00:11,00:13,"under the control of the enemy,"
953,#1610,2023-05-12T18:49:00Z,00:13,00:17,there are less than 2 square kilometers left.
952,#1609,2023-05-12T18:17:00Z,00:00,00:07,"The ChVK-Wagner units moved up to 400 meters,"
952,#1609,2023-05-12T18:17:00Z,00:07,00:09,"under the control of the enemy,"
952,#1609,2023-05-12T18:17:00Z,00:09,00:14,"there are exactly 2 square kilometers of ""Bahmut""."
952,#1609,2023-05-12T18:17:00Z,00:14,00:22,"The area of the advance was 132,000 square meters."
952,#1609,2023-05-12T18:17:00Z,00:22,00:24,"On the right flank,"
952,#1609,2023-05-12T18:17:00Z,00:24,00:27,the MORF units
952,#1609,2023-05-12T18:17:00Z,00:27,00:31,"lost territory today,"
952,#1609,2023-05-12T18:17:00Z,00:31,00:35,the number of square kilometers is being clarified.
950,#1608,2023-05-12T17:39:32Z,00:01,00:06,Comrade Sobolev must remember
950,#1608,2023-05-12T17:39:32Z,00:06,00:09,"that he is a military man,"
950,#1608,2023-05-12T17:39:32Z,00:09,00:14,that he received colossal social support
950,#1608,2023-05-12T17:39:32Z,00:14,00:16,from his country
950,#1608,2023-05-12T17:39:32Z,00:16,00:20,"and lived a carefree life,"
950,#1608,2023-05-12T17:39:32Z,00:20,00:23,judging by his biography.
950,#1608,2023-05-12T17:39:32Z,00:23,00:28,"He must go to the side of the ""Bahmut"""
950,#1608,2023-05-12T17:39:32Z,00:28,00:32,"and stop the troops that are trapping,"
950,#1608,2023-05-12T17:39:32Z,00:32,00:34,"which, by the way, today"
950,#1608,2023-05-12T17:39:32Z,00:34,00:40,threw another very significant piece of territory.
950,#1608,2023-05-12T17:39:32Z,00:40,00:46,"And therefore, the story of tactical retreats"
950,#1608,2023-05-12T17:39:32Z,00:46,00:48,"is nothing more than running,"
950,#1608,2023-05-12T17:39:32Z,00:48,00:50,"trapping,"
950,#1608,2023-05-12T17:39:32Z,00:50,00:52,total cowardice
950,#1608,2023-05-12T17:39:32Z,00:52,00:54,and what lies in shame
950,#1608,2023-05-12T17:39:32Z,00:54,00:57,in the history of our country
950,#1608,2023-05-12T17:39:32Z,00:57,01:00,for the next many years.
950,#1608,2023-05-12T17:39:32Z,01:00,01:03,"Therefore, forward!"
950,#1608,2023-05-12T17:39:32Z,01:03,01:05,"The assault rifle in hand,"
950,#1608,2023-05-12T17:39:32Z,01:05,01:08,"at the same time, take with you the leadership of the Ministry of Defense,"
950,#1608,2023-05-12T17:39:32Z,01:08,01:11,which must participate in stopping
950,#1608,2023-05-12T17:39:32Z,01:11,01:13,"these trapping columns,"
950,#1608,2023-05-12T17:39:32Z,01:13,01:16,"which, in shame,"
950,#1608,2023-05-12T17:39:32Z,01:16,01:18,"leave all territories,"
950,#1608,2023-05-12T17:39:32Z,01:18,01:22,when the unprofessional ChVK-Wagner
950,#1608,2023-05-12T17:39:32Z,01:22,01:28,took these territories with his blood and the bodies of his comrades.
950,#1608,2023-05-12T17:39:32Z,01:28,01:31,"If you, Mr. Sobolev,"
950,#1608,2023-05-12T17:39:32Z,01:31,01:34,were engaged in the business
950,#1608,2023-05-12T17:39:32Z,01:34,01:37,for which the Motherland spent millions of rubles
950,#1608,2023-05-12T17:39:32Z,01:37,01:40,on your training and on your maintenance
950,#1608,2023-05-12T17:39:32Z,01:40,01:42,"of you, your family,"
950,#1608,2023-05-12T17:39:32Z,01:42,01:44,"and everything you needed,"
950,#1608,2023-05-12T17:39:32Z,01:44,01:47,then ChVK-Wagner would not be needed at all.
950,#1608,2023-05-12T17:39:32Z,01:47,01:49,"We spend ammunition,"
950,#1608,2023-05-12T17:39:32Z,01:49,01:52,including in order to stop
950,#1608,2023-05-12T17:39:32Z,01:52,01:54,the trapping crowds
950,#1608,2023-05-12T17:39:32Z,01:54,01:57,of servicemen of the Russian army.
949,#1607,2023-05-12T14:40:20Z,00:00,00:03,"- Philip, good afternoon!"
949,#1607,2023-05-12T14:40:20Z,00:03,00:07,I'm not going to visit
949,#1607,2023-05-12T14:40:20Z,00:07,00:10,"the Army of 2023 in any way,"
949,#1607,2023-05-12T14:40:20Z,00:10,00:13,"because in the Army of 2022,"
949,#1607,2023-05-12T14:40:20Z,00:13,00:15,"as far as I know,"
949,#1607,2023-05-12T14:40:20Z,00:15,00:18,"except for the dog with a grenade launcher on its back,"
949,#1607,2023-05-12T14:40:20Z,00:18,00:21,there was nothing else valuable.
949,#1607,2023-05-12T14:40:20Z,00:21,00:25,"Unfortunately, at the moment"
949,#1607,2023-05-12T14:40:20Z,00:25,00:30,the Army is in a global depression.
949,#1607,2023-05-12T14:40:20Z,00:30,00:32,[laughter]
947,#1605,2023-05-12T11:47:44Z,00:01,00:08,"Now I will get to the nearest headquarters, where I can explain and explain what it is."
947,#1605,2023-05-12T11:47:44Z,00:08,00:15,"What Konashenkov said, unfortunately, is called ""escaping"", not ""regrouping""."
947,#1605,2023-05-12T11:47:44Z,00:15,00:18,"And how it looks, I will explain in more detail."
945,#1603,2023-05-11T19:03:01Z,00:01,00:06,"ChVK ""Wagner"" is moving in the nest of ""Bahmut"" in the western direction."
945,#1603,2023-05-11T19:03:01Z,00:06,00:11,The maximum advance was 220 meters.
945,#1603,2023-05-11T19:03:01Z,00:11,00:15,"Occupied 68,500 meters."
945,#1603,2023-05-11T19:03:01Z,00:15,00:21,Under the control of the enemy 2.18 kilometers.
945,#1603,2023-05-11T19:03:01Z,00:21,00:25,We move like a horse with fur coats forward.
945,#1603,2023-05-11T19:03:01Z,00:25,00:27,End of part one.
943,#1601,2023-05-11T16:18:52Z,00:00,00:10,Musicians are not in reserve. They are either in Artyomovsk or dead.
943,#1601,2023-05-11T16:18:52Z,00:10,00:29,"In recent times, everything has been done to dry out the musicians as much as possible, because they are too problematic and too active. Yes, they were drying out. I have said this many times. But everyone was talking about the fact that the boy saw a fucking wolf."
943,#1601,2023-05-11T16:18:52Z,00:29,00:45,"The wolf came. Let's go ahead, guys, to the barricades, to sort it out. All musicians are involved. There are no reserves for musicians. And the flanks must be kept and not to run away, to stand still."
943,#1601,2023-05-11T16:18:52Z,00:45,00:52,"When you stand still, then everything will be great. Then the Motherland will be safe."
942,#1600,2023-05-11T13:51:07Z,00:00,00:14,"Today, the assault groups of the ChVK ""Wagner"", moving to the western outskirts of Artyomovsk, have entered the so-called ""nest"". There are 625 meters left to the western outskirts."
942,#1600,2023-05-11T13:51:07Z,00:14,00:37,"The situation on the flanks is the worst of the predicted scenarios. Those territories that, with the blood and lives of our comrades-in-arms, were taken for many months, every day, passing by tens or hundreds of meters,"
942,#1600,2023-05-11T13:51:07Z,00:37,00:45,"are being thrown by those who must hold our flanks today, almost without a fight."
942,#1600,2023-05-11T13:51:07Z,00:45,00:47,Bye!
941,#1599,2023-05-11T12:52:19Z,00:01,00:08,What Yasir Al-Asta said in an interview today is absolute nonsense.
941,#1599,2023-05-11T12:52:19Z,00:08,00:11,Wagner is not in Sudan.
941,#1599,2023-05-11T12:52:19Z,00:11,00:19,"Moreover, all the geological developments that were once in Sudan are long, long closed."
941,#1599,2023-05-11T12:52:19Z,00:20,00:30,Wagner never got involved in domestic affairs in Sudan after Omar al-Bashir's departure.
941,#1599,2023-05-11T12:52:19Z,00:30,00:42,"But I want to remind you that Yasir al-Asta was the same person who wrote large letters to kill the demonstrators,"
941,#1599,2023-05-11T12:52:19Z,00:43,00:50,and told how to do it both in the days of Omar al-Bashir and in the days of Burhan.
941,#1599,2023-05-11T12:52:19Z,00:50,00:57,It was this person who gave recommendations and guided who to kill and who not to kill.
941,#1599,2023-05-11T12:52:19Z,00:57,01:02,"Therefore, you can not believe this lie in any case."
941,#1599,2023-05-11T12:52:19Z,01:02,01:11,"It was a person who was always called, he had a nickname, ""Blacksmith""."
940,#1598,2023-05-11T09:48:15Z,00:01,00:03,About the counteroffensive.
940,#1598,2023-05-11T09:48:15Z,00:03,00:06,Vladislav Zelinsky is a swindler.
940,#1598,2023-05-11T09:48:15Z,00:06,00:09,The counteroffensive is in full swing.
940,#1598,2023-05-11T09:48:15Z,00:09,00:15,"In the Artemovsk direction, the units of the Air Force enter the flanks."
940,#1598,2023-05-11T09:48:15Z,00:15,00:20,"And, unfortunately, in some places they succeed."
940,#1598,2023-05-11T09:48:15Z,00:20,00:24,We go further to Artemovsk in order to close it.
940,#1598,2023-05-11T09:48:15Z,00:24,00:29,"As I have said many times, the plan of the Air Force is in action."
940,#1598,2023-05-11T09:48:15Z,00:29,00:33,"We go and capture them, they capture us."
940,#1598,2023-05-11T09:48:15Z,00:33,00:38,"For the Air Force, it is important to break through the Artemovsk direction."
940,#1598,2023-05-11T09:48:15Z,00:38,00:46,The next direction will be the Belyansk and Belgorod regions with the exit to the territory of the Russian Federation and Zaporozhye.
940,#1598,2023-05-11T09:48:15Z,00:46,00:53,"They need to first deal with the Artemovsk direction of Chuvakov Wagner, finish this story."
940,#1598,2023-05-11T09:48:15Z,00:54,01:02,"And after that, on the rise, with all the fighting spirit, go to Zaporozhye, Belyansk and Belgorod regions."
940,#1598,2023-05-11T09:48:15Z,01:02,01:06,"Therefore, the offensive in the Air Force has begun."
940,#1598,2023-05-11T09:48:15Z,01:06,01:18,"All the units that have passed the preparation, received the necessary weapons, equipment, tanks and everything else, they are already fully engaged."
940,#1598,2023-05-11T09:48:15Z,01:19,01:29,"And after they try their strength, they will stretch their muscles, then the northern and southern directions will be engaged."
940,#1598,2023-05-11T09:48:15Z,01:29,01:39,"Chuvakov Wagner continues to perform combat missions in a terrible shortage of ammunition, in a shell hunger,"
940,#1598,2023-05-11T09:48:15Z,01:39,01:44,because all the promises that were given to the Ministry of Defense are not fulfilled.
940,#1598,2023-05-11T09:48:15Z,01:45,01:49,"How we go, I'll tell you later, when we finish Artemovsk."
940,#1598,2023-05-11T09:48:15Z,01:49,01:51,[References]
939,#1597,2023-05-10T18:34:07Z,00:01,00:09,"Today, the ChVK ""Wagner"" units have advanced 50,000 meters."
939,#1597,2023-05-10T18:34:07Z,00:09,00:14,The maximum advance was 170 meters.
939,#1597,2023-05-10T18:34:07Z,00:14,00:28,The enemy remains in control of the area of about 2.25 square kilometers.
939,#1597,2023-05-10T18:34:07Z,00:28,00:37,"We continue to move in the center of the multi-story building of ""Bahmut"" in the western outskirts of the city."
936,#1594,2023-05-10T12:00:14Z,00:01,00:06,"Ellison, finally! I missed you!"
936,#1594,2023-05-10T12:00:14Z,00:06,00:10,I just gave the answer to the RTVI.
936,#1594,2023-05-10T12:00:14Z,00:10,00:16,I am ready to duplicate their request and their answer. Everything is written about my grandfather there.
936,#1594,2023-05-10T12:00:14Z,00:16,00:18,[References]
935,#1593,2023-05-10T11:55:54Z,00:01,00:03,I'll answer the first question.
935,#1593,2023-05-10T11:55:54Z,00:03,00:11,I was talking about my grandfather in the context of the fact that we are not given shells and they are kept in warehouses.
935,#1593,2023-05-10T11:55:54Z,00:11,00:14,And who can be a grandfather?
935,#1593,2023-05-10T11:55:54Z,00:14,00:23,"Option number one - Mezintsev, who was fired for giving us shells, and therefore now he cannot give us shells."
935,#1593,2023-05-10T11:55:54Z,00:23,00:35,"The head of the General Staff, Valery Vasilievich Gerasimov, who is supposed to give us shells, but we do not receive shells."
935,#1593,2023-05-10T11:55:54Z,00:35,00:39,"In sufficient volume, and we receive only 10%."
935,#1593,2023-05-10T11:55:54Z,00:39,00:49,"And the third option is Natalia Him, who appeared in social networks, offering us boxes with shells."
935,#1593,2023-05-10T11:55:54Z,00:49,00:58,"Choose any of these options, whom I called my grandfather - Mezintsev, Gerasimov or Natalia Him."
935,#1593,2023-05-10T11:55:54Z,00:58,01:01,I answer the second question.
935,#1593,2023-05-10T11:55:54Z,01:01,01:09,"There are meetings all day long, we are scraping out every day after a series of meetings of 5-10 hours,"
935,#1593,2023-05-10T11:55:54Z,01:09,01:13,"on which we do not participate, but the representatives of the Ministry of Defense participate,"
935,#1593,2023-05-10T11:55:54Z,01:13,01:18,we scrape out the minimum amount for the next day.
935,#1593,2023-05-10T11:55:54Z,01:18,01:22,"Therefore, we were not given enough shells."
935,#1593,2023-05-10T11:55:54Z,01:22,01:25,We continue to move in Artemovsk.
935,#1593,2023-05-10T11:55:54Z,01:25,01:36,"After my appeals, the command to the Ministry of Defense received from the leadership of the country to consider all our applications."
935,#1593,2023-05-10T11:55:54Z,01:36,01:41,"In view of the bureaucracy, unfortunately, this is done for a very long time."
935,#1593,2023-05-10T11:55:54Z,01:41,01:46,Information companies have been going against me for many years.
935,#1593,2023-05-10T11:55:54Z,01:46,01:53,"Customers are constantly changing, starting from Navalny, ending with the Americans."
935,#1593,2023-05-10T11:55:54Z,01:53,01:58,The fourth question is about the Russian activist Natalia Him.
935,#1593,2023-05-10T11:55:54Z,01:58,02:07,"Yes, indeed, she gave the ammunition, the volumes, as you yourself understand and saw on the video, are very small."
935,#1593,2023-05-10T11:55:54Z,02:07,02:10,"In any case, thank you very much to her."
933,NA,2023-05-10T09:55:33Z,00:00,00:12,"It is necessary to seriously determine how the organization can be endowed with the term ""terrorist""."
933,NA,2023-05-10T09:55:33Z,00:12,00:20,"Terrorism, as follows from Wikipedia and other sources,"
933,NA,2023-05-10T09:55:33Z,00:20,00:29,is a violent way of putting pressure on political opponents to achieve their results.
933,NA,2023-05-10T09:55:33Z,00:29,00:46,"For example, ISIS blew up everything in the world so that the world would step aside from them and give them the opportunity to make their own state in Syria and Iraq."
933,NA,2023-05-10T09:55:33Z,00:46,01:05,"And in this state, ISIS also, by physical influence on people, cutting off their heads, arms, and so on, built up certain orders, as they thought, of the correct existence of the state."
933,NA,2023-05-10T09:55:33Z,01:05,01:17,"Al-Qaeda and Osama Bin Laden fought for the creation of a world caliphate, that is, they in a number of countries, in many countries,"
933,NA,2023-05-10T09:55:33Z,01:17,01:26,wanted to make a new principle of world order with new rules that they considered to be true.
933,NA,2023-05-10T09:55:33Z,01:26,01:32,"For violating these rules - death, and all those who interfere with them - death."
933,NA,2023-05-10T09:55:33Z,01:32,01:43,"Khatib Masin, Boko Haram and a bunch of other terrorist organizations, they define for themselves their habitat area,"
933,NA,2023-05-10T09:55:33Z,01:43,01:53,"and in this habitat area, in fact, they dictate laws and, most importantly, engage in smuggling and racketeering."
933,NA,2023-05-10T09:55:33Z,01:53,02:02,"CVK Wagner does not dictate his laws in the states, but lives according to the laws of those states that exist."
933,NA,2023-05-10T09:55:33Z,02:02,02:13,"And acts in the interests, as I have repeated many times, of the official governments, saving people from terrorists."
933,NA,2023-05-10T09:55:33Z,02:13,02:23,They are located on the territory of the Russian Federation and are absolutely legal citizens of the Russian Federation.
933,NA,2023-05-10T09:55:33Z,02:23,02:31,"On the territory of Donbass, they are fighting against Ukraine, just like all Russian military personnel."
933,NA,2023-05-10T09:55:33Z,02:31,02:37,"Perhaps, in some cases, more effectively."
933,NA,2023-05-10T09:55:33Z,02:37,02:48,"Thus, for all those who decide whether CVK Wagner should be identified by a terrorist organization or not,"
933,NA,2023-05-10T09:55:33Z,02:48,02:53,"at least some definition must be obtained, and why so."
933,NA,2023-05-10T09:55:33Z,02:53,03:02,"Or just, you, gentlemen, foreigners, get out of CVK Wagner, because we look you in the eyes,"
933,NA,2023-05-10T09:55:33Z,03:02,03:07,"we do not take our eyes away, and you become a little bit of a mess."
933,NA,2023-05-10T09:55:33Z,03:07,03:19,"This is another, more serious question for the French, English, Europeans, Americans, and everyone else who wants to hype and recognize CVK Wagner as a terrorist organization."
932,#1591,2023-05-10T09:55:20Z,00:00,00:07,"Dear Daily Best editorial staff, my first question is where is Alison?"
932,#1591,2023-05-10T09:55:20Z,00:07,00:08,Give Alison back.
932,#1591,2023-05-10T09:55:20Z,00:08,00:19,"Now, in fact, it is extremely unpleasant for me that Emmanuel and Carl literally agreed on the fact that Wagner is a human."
932,#1591,2023-05-10T09:55:20Z,00:19,00:27,"They have always been antagonists for their thousand-year history, and here they went in one direction."
932,#1591,2023-05-10T09:55:20Z,00:27,00:31,"Therefore, I am very disappointed by this."
932,#1591,2023-05-10T09:55:20Z,00:31,00:37,"And thirdly, what should be done with organizations that you consider to be terrorist."
932,#1591,2023-05-10T09:55:20Z,00:37,00:40,I certainly have to give you advice.
932,#1591,2023-05-10T09:55:20Z,00:40,00:49,"First, you must decide how you can collect as many people as possible locally to Wagner,"
932,#1591,2023-05-10T09:55:20Z,00:49,00:55,so that it does not turn out like with ISIS and al-Qaeda that you will scatter us all over the world.
932,#1591,2023-05-10T09:55:20Z,00:55,01:03,"Secondly, you must destroy the heads of the organization, well, actually, first of all, me, of course."
932,#1591,2023-05-10T09:55:20Z,01:03,01:12,"Therefore, if your special services contact me, I will give a certain number of advice on how to do this."
932,#1591,2023-05-10T09:55:20Z,01:12,01:21,"Well, in the future, of course, ideologically, you must actively oppose what Wagner is carrying."
932,#1591,2023-05-10T09:55:20Z,01:21,01:30,"And this is social justice, freedom, the salvation of the peaceful population of various states,"
932,#1591,2023-05-10T09:55:20Z,01:30,01:37,in which you have been cutting out organs for a long time and mocking them.
932,#1591,2023-05-10T09:55:20Z,01:37,01:46,"But this is also a separate long conversation, so send your representatives, preferably quietly,"
932,#1591,2023-05-10T09:55:20Z,01:46,01:52,"so that no one knows that they are with us, and we will think of how to help them."
932,#1591,2023-05-10T09:55:20Z,01:52,02:02,"Well, of course, thank you for this recognition, because I had a problem with my speech at the State Duma,"
932,#1591,2023-05-10T09:55:20Z,02:02,02:06,"and everyone argues who I can speak at the State Duma,"
932,#1591,2023-05-10T09:55:20Z,02:06,02:10,"since Chuvak Wagner has no status within the Russian Federation,"
932,#1591,2023-05-10T09:55:20Z,02:10,02:17,"and now it will have a status of a terrorist organization, and, in fact, I will be assigned an official status,"
